Label,Value,Decimals,UnitId,Description,Key
ScripCode,532540,0,,Scrip code,ScripCode
Symbol,TCS,0,,Symbol,Symbol
MSEISymbol,Notlisted,0,,MSEI symbol,MSEISymbolMseiSymbol
ISIN,INE467B01029,0,,ISIN,ISINIsin
NameOfTheCompany,Tata Consultancy Services Limited,0,,Name of the company,NameOfTheCompany
ClassOfSecurity,Equity,0,,Class of security,ClassOfSecurity
DateOfStartOfFinancialYear,2024-04-01,0,,Date of start of financial year,DateOfStartOfFinancialYear
DateOfEndOfFinancialYear,2025-03-31,0,,Date of end of financial year,DateOfEndOfFinancialYear
DateOfBoardMeetingWhenFinancialResultsWereApproved,2025-01-09,0,,Date of board meeting when financial results were approved,DateOfBoardMeetingWhenFinancialResultsWereApproved
DateOnWhichPriorIntimationOfTheMeetingForConsideringFinancialResultsWasInformedToTheExchange,2024-12-31,0,,Date on which prior intimation of the meeting for considering financial results was informed to the exchange,DateOnWhichPriorIntimationOfTheMeetingForConsideringFinancialResultsWasInformedToTheExchange
DescriptionOfPresentationCurrency,INR,0,,Description of presentation currency,DescriptionOfPresentationCurrency
LevelOfRoundingUsedInFinancialStatements,Crores,0,,Level of rounding used in financial statements,LevelOfRoundingUsedInFinancialStatements
ReportingQuarter,Third quarter,0,,Reporting quarter,ReportingQuarter
IsCompanyReportingMultisegmentOrSingleSegment,Multi segment,0,,Is company reporting multisegment or single segment,IsCompanyReportingMultisegmentOrSingleSegment
DateOfStartOfBoardMeeting,2025-01-09,0,,Date of start of board meeting,DateOfStartOfBoardMeeting
StartTimeOfBoardMeeting,11:30:00,0,,Start time of board meeting,StartTimeOfBoardMeeting
DateOfEndOfBoardMeeting,2025-01-09,0,,Date of end of board meeting,DateOfEndOfBoardMeeting
EndTimeOfBoardMeeting,16:00:00,0,,End time of board meeting,EndTimeOfBoardMeeting
DeclarationOfUnmodifiedOpinionOrStatementOnImpactOfAuditQualification,Not applicable,0,,Declaration of unmodified opinion or statement on impact of audit qualification,DeclarationOfUnmodifiedOpinionOrStatementOnImpactOfAuditQualification
DateOfStartOfReportingPeriod,2024-04-01,0,,Date of start of reporting period,DateOfStartOfReportingPeriod
DateOfEndOfReportingPeriod,2024-12-31,0,,Date of end of reporting period,DateOfEndOfReportingPeriod
WhetherResultsAreAuditedOrUnaudited,Audited,0,,Whether results are audited or unaudited,WhetherResultsAreAuditedOrUnaudited
NatureOfReportStandaloneConsolidated,Consolidated,0,,Nature of report standalone consolidated,NatureOfReportStandaloneConsolidated
RevenueFromOperations,1908450000000,-7,INR,Revenue from operations,RevenueFromOperations
OtherIncome,29340000000,-7,INR,Other income,OtherIncome
Income,1937790000000,-7,INR,Total income,IncomeTotalIncome
CostOfMaterialsConsumed,0,-7,INR,Cost of materials consumed,CostOfMaterialsConsumed
PurchasesOfStockInTrade,0,-7,INR,Purchases of stock-in-trade,PurchasesOfStockInTrade
ChangesInInventoriesOfFinishedGoodsWorkInProgressAndStockInTrade,0,-7,INR,Changes in inventories of finished goods'| work-in-progress and stock-in-trade,ChangesInInventoriesOfFinishedGoodsWorkInProgressAndStockInTrade
EmployeeBenefitExpense,1090260000000,-7,INR,Employee benefit expense,EmployeeBenefitExpense
FinanceCosts,5690000000,-7,INR,Finance costs,FinanceCosts
DepreciationDepletionAndAmortisationExpense,38630000000,-7,INR,Depreciation'| depletion and amortisation expense,DepreciationDepletionAndAmortisationExpense
OtherExpenses,313920000000,-7,INR,Other expenses Sum,OtherExpensesOtherExpensesSum
Expenses,1448500000000,-7,INR,Total Expenses,ExpensesTotalExpenses
ProfitBeforeExceptionalItemsAndTax,489290000000,-7,INR,Total profit before exceptional items and tax,ProfitBeforeExceptionalItemsAndTaxTotalProfitBeforeExceptionalItemsAndTax
ExceptionalItemsBeforeTax,0,-7,INR,Exceptional items before tax,ExceptionalItemsBeforeTax
ProfitBeforeTax,489290000000,-7,INR,Total profit before tax,ProfitBeforeTaxTotalProfitBeforeTax
CurrentTax,125850000000,-7,INR,Current tax,CurrentTax
DeferredTax,-1600000000,-7,INR,Deferred tax,DeferredTax
TaxExpense,124250000000,-7,INR,Total tax expense,TaxExpenseTotalTaxExpense
NetMovementInRegulatoryDeferralAccountBalancesRelatedToProfitOrLossAndTheRelatedDeferredTaxMovement,0,-7,INR,Net movement in regulatory deferral account balances related to profit or loss and the related deferred tax movement,NetMovementInRegulatoryDeferralAccountBalancesRelatedToProfitOrLossAndTheRelatedDeferredTaxMovement
ProfitLossForPeriodFromContinuingOperations,365040000000,-7,INR,Net profit (loss) for period from continuing operations,ProfitLossForPeriodFromContinuingOperationsNetProfitLossForPeriodFromContinuingOperations
ProfitLossFromDiscontinuedOperationsBeforeTax,0,-7,INR,Profit (loss) from discontinued operations before tax,ProfitLossFromDiscontinuedOperationsBeforeTax
TaxExpenseOfDiscontinuedOperations,0,-7,INR,Tax expense of discontinued operations,TaxExpenseOfDiscontinuedOperations
ProfitLossFromDiscontinuedOperationsAfterTax,0,-7,INR,Net profit (loss) from discontinued operations after tax,ProfitLossFromDiscontinuedOperationsAfterTaxNetProfitLossFromDiscontinuedOperationsAfterTax
ShareOfProfitLossOfAssociatesAndJointVenturesAccountedForUsingEquityMethod,0,-7,INR,Share of profit (loss) of associates and joint ventures accounted for using equity method,ShareOfProfitLossOfAssociatesAndJointVenturesAccountedForUsingEquityMethod
ProfitLossForPeriod,365040000000,-7,INR,Total profit (loss) for period,ProfitLossForPeriodTotalProfitLossForPeriod
OtherComprehensiveIncomeNetOfTaxes,270000000,-7,INR,Other comprehensive income net of taxes,OtherComprehensiveIncomeNetOfTaxes
ComprehensiveIncomeForThePeriod,365310000000,-7,INR,Total comprehensive income for the period,ComprehensiveIncomeForThePeriodTotalComprehensiveIncomeForThePeriod
ProfitOrLossAttributableToOwnersOfParent,363290000000,-7,INR,Profit or loss'| attributable to owners of parent,ProfitOrLossAttributableToOwnersOfParent
ProfitOrLossAttributableToNonControllingInterests,1750000000,-7,INR,Profit or loss'| attributable to non-controlling interests,ProfitOrLossAttributableToNonControllingInterests
ComprehensiveIncomeForThePeriodAttributableToOwnersOfParent,363590000000,-7,INR,Total comprehensive income for the period attributable to owners of parent,ComprehensiveIncomeForThePeriodAttributableToOwnersOfParentTotalComprehensiveIncomeForThePeriodAttributableToOwnersOfParent
ComprehensiveIncomeForThePeriodAttributableToOwnersOfParentNonControllingInterests,1720000000,-7,INR,Total comprehensive income for the period attributable to owners of parent non-controlling interests,ComprehensiveIncomeForThePeriodAttributableToOwnersOfParentNonControllingInterestsTotalComprehensiveIncomeForThePeriodAttributableToOwnersOfParentNonControllingInterests
PaidUpValueOfEquityShareCapital,3620000000,-7,INR,Paid-up equity share capital,PaidUpValueOfEquityShareCapitalPaidUpEquityShareCapital
FaceValueOfEquityShareCapital,1,0,INRPerShare,Face value of equity share capital,FaceValueOfEquityShareCapital
BasicEarningsLossPerShareFromContinuingOperations,100.4,0,INRPerShare,Basic earnings (loss) per share from continuing operations,BasicEarningsLossPerShareFromContinuingOperations
DilutedEarningsLossPerShareFromContinuingOperations,100.4,0,INRPerShare,Diluted earnings (loss) per share from continuing operations,DilutedEarningsLossPerShareFromContinuingOperations
BasicEarningsLossPerShareFromDiscontinuedOperations,0,0,INRPerShare,Basic earnings (loss) per share from discontinued operations,BasicEarningsLossPerShareFromDiscontinuedOperations
DilutedEarningsLossPerShareFromDiscontinuedOperations,0,0,INRPerShare,Diluted earnings (loss) per share from discontinued operations,DilutedEarningsLossPerShareFromDiscontinuedOperations
BasicEarningsLossPerShareFromContinuingAndDiscontinuedOperations,100.4,0,INRPerShare,Total basic earnings (loss) per share from continuing and discontinued operations,BasicEarningsLossPerShareFromContinuingAndDiscontinuedOperationsTotalBasicEarningsLossPerShareFromContinuingAndDiscontinuedOperations
DilutedEarningsLossPerShareFromContinuingAndDiscontinuedOperations,100.4,0,INRPerShare,Total diluted earnings (loss) per share from continuing and discontinued operations,DilutedEarningsLossPerShareFromContinuingAndDiscontinuedOperationsTotalDilutedEarningsLossPerShareFromContinuingAndDiscontinuedOperations
OtherExpenses,89000000000,-7,INR,Cost of equipment and software licences,OtherExpensesCostOfEquipmentAndSoftwareLicences
OtherExpenses,224920000000,-7,INR,Other expenses,OtherExpenses
SegmentRevenue,703400000000,-7,INR,Banking'| Financial Services and Insurance,SegmentRevenueBankingFinancialServicesAndInsurance
SegmentRevenue,187750000000,-7,INR,Manufacturing,SegmentRevenueManufacturing
SegmentRevenue,300510000000,-7,INR,Consumer Business,SegmentRevenueConsumerBusiness
SegmentRevenue,348710000000,-7,INR,Communication'| Media and Technology,SegmentRevenueCommunicationMediaAndTechnology
SegmentRevenue,199650000000,-7,INR,Life Sciences and Healthcare,SegmentRevenueLifeSciencesAndHealthcare
SegmentRevenue,168430000000,-7,INR,Others,SegmentRevenueOthers
SegmentRevenue,1908450000000,-7,INR,Segment revenue,SegmentRevenue
SegmentRevenueFromOperations,1908450000000,-7,INR,Revenue from operations,SegmentRevenueFromOperationsRevenueFromOperations
SegmentProfitLossBeforeTaxAndFinanceCosts,187590000000,-7,INR,Banking'| Financial Services and Insurance,SegmentProfitLossBeforeTaxAndFinanceCostsBankingFinancialServicesAndInsurance
SegmentProfitLossBeforeTaxAndFinanceCosts,61960000000,-7,INR,Manufacturing,SegmentProfitLossBeforeTaxAndFinanceCostsManufacturing
SegmentProfitLossBeforeTaxAndFinanceCosts,82930000000,-7,INR,Consumer Business,SegmentProfitLossBeforeTaxAndFinanceCostsConsumerBusiness
SegmentProfitLossBeforeTaxAndFinanceCosts,72060000000,-7,INR,Communication'| Media and Technology,SegmentProfitLossBeforeTaxAndFinanceCostsCommunicationMediaAndTechnology
SegmentProfitLossBeforeTaxAndFinanceCosts,57570000000,-7,INR,Life Sciences and Healthcare,SegmentProfitLossBeforeTaxAndFinanceCostsLifeSciencesAndHealthcare
SegmentProfitLossBeforeTaxAndFinanceCosts,42160000000,-7,INR,Others,SegmentProfitLossBeforeTaxAndFinanceCostsOthers
SegmentProfitLossBeforeTaxAndFinanceCosts,504270000000,-7,INR,Segment profit (loss) before tax and finance costs,SegmentProfitLossBeforeTaxAndFinanceCosts
SegmentFinanceCosts,5690000000,-7,INR,Segment finance costs,SegmentFinanceCosts
OtherUnallocableExpenditureNetOffUnAllocableIncome,9290000000,-7,INR,Other unallocable expenditure net off un-allocable income,OtherUnallocableExpenditureNetOffUnAllocableIncome
SegmentProfitBeforeTax,489290000000,-7,INR,Profit before tax,SegmentProfitBeforeTaxProfitBeforeTax
AmountOfItemThatWillNotBeReclassifiedToProfitAndLoss,540000000,-7,INR,Remeasurement of defined employee benefit plans,AmountOfItemThatWillNotBeReclassifiedToProfitAndLossRemeasurementOfDefinedEmployeeBenefitPlans
AmountOfItemThatWillNotBeReclassifiedToProfitAndLoss,-180000000,-7,INR,Net change in fair values of investments in equity shares carried at fair value through OCI,AmountOfItemThatWillNotBeReclassifiedToProfitAndLossNetChangeInFairValuesOfInvestmentsInEquitySharesCarriedAtFairValueThroughOci
AmountOfItemThatWillNotBeReclassifiedToProfitAndLoss,360000000,-7,INR,Amount of item that will not be reclassified to profit and loss,AmountOfItemThatWillNotBeReclassifiedToProfitAndLoss
IncomeTaxRelatingToItmesThatWillNotBeReclassifiedToProfitOrLoss,220000000,-7,INR,Income tax relating to items that will not be reclassified to profit or loss,IncomeTaxRelatingToItmesThatWillNotBeReclassifiedToProfitOrLossIncomeTaxRelatingToItemsThatWillNotBeReclassifiedToProfitOrLoss
AmountOfItemThatWillBeReclassifiedToProfitAndLoss,3130000000,-7,INR,Net change in fair values of investments other than equity shares carried at fair value through OCI,AmountOfItemThatWillBeReclassifiedToProfitAndLossNetChangeInFairValuesOfInvestmentsOtherThanEquitySharesCarriedAtFairValueThroughOci
AmountOfItemThatWillBeReclassifiedToProfitAndLoss,190000000,-7,INR,Net change in intrinsic value of derivatives designated as cash flow hedges,AmountOfItemThatWillBeReclassifiedToProfitAndLossNetChangeInIntrinsicValueOfDerivativesDesignatedAsCashFlowHedges
AmountOfItemThatWillBeReclassifiedToProfitAndLoss,0,-7,INR,Net change in time value of derivatives designated as cash flow hedges,AmountOfItemThatWillBeReclassifiedToProfitAndLossNetChangeInTimeValueOfDerivativesDesignatedAsCashFlowHedges
AmountOfItemThatWillBeReclassifiedToProfitAndLoss,-2370000000,-7,INR,Exchange differences on translation of financial statements of foreign operations,AmountOfItemThatWillBeReclassifiedToProfitAndLossExchangeDifferencesOnTranslationOfFinancialStatementsOfForeignOperations
AmountOfItemThatWillBeReclassifiedToProfitAndLoss,950000000,-7,INR,Amount of item that will be reclassified to profit and loss,AmountOfItemThatWillBeReclassifiedToProfitAndLoss
IncomeTaxRelatingToItmesThatWillBeReclassifiedToProfitOrLoss,820000000,-7,INR,Income tax relating to items that will be reclassified to profit or loss,IncomeTaxRelatingToItmesThatWillBeReclassifiedToProfitOrLossIncomeTaxRelatingToItemsThatWillBeReclassifiedToProfitOrLoss
XbrlUrl,https://www.bseindia.com/XBRLFILES/FourOneUploadDocument/Main_Ind_As_532540_912025213054.xml,0,,XbrlUrl,
