Label,Value,Decimals,UnitId,Description,Key
ScripCode,532540,0,,Scrip code,ScripCode
Symbol,TCS,0,,Symbol,Symbol
MSEISymbol,Notlisted,0,,MSEI symbol,MSEISymbolMseiSymbol
ISIN,INE467B01029,0,,ISIN,ISINIsin
NameOfTheCompany,Tata Consultancy Services Limited,0,,Name of the company,NameOfTheCompany
ClassOfSecurity,Equity,0,,Class of security,ClassOfSecurity
DateOfStartOfFinancialYear,2024-04-01,0,,Date of start of financial year,DateOfStartOfFinancialYear
DateOfEndOfFinancialYear,2025-03-31,0,,Date of end of financial year,DateOfEndOfFinancialYear
DateOfBoardMeetingWhenFinancialResultsWereApproved,2024-10-10,0,,Date of board meeting when financial results were approved,DateOfBoardMeetingWhenFinancialResultsWereApproved
DateOnWhichPriorIntimationOfTheMeetingForConsideringFinancialResultsWasInformedToTheExchange,2024-09-30,0,,Date on which prior intimation of the meeting for considering financial results was informed to the exchange,DateOnWhichPriorIntimationOfTheMeetingForConsideringFinancialResultsWasInformedToTheExchange
DescriptionOfPresentationCurrency,INR,0,,Description of presentation currency,DescriptionOfPresentationCurrency
LevelOfRoundingUsedInFinancialStatements,Crores,0,,Level of rounding used in financial statements,LevelOfRoundingUsedInFinancialStatements
ReportingQuarter,Half yearly,0,,Reporting quarter,ReportingQuarter
IsCompanyReportingMultisegmentOrSingleSegment,Multi segment,0,,Is company reporting multisegment or single segment,IsCompanyReportingMultisegmentOrSingleSegment
DateOfStartOfBoardMeeting,2024-10-10,0,,Date of start of board meeting,DateOfStartOfBoardMeeting
StartTimeOfBoardMeeting,12:30:00,0,,Start time of board meeting,StartTimeOfBoardMeeting
DateOfEndOfBoardMeeting,2024-10-10,0,,Date of end of board meeting,DateOfEndOfBoardMeeting
EndTimeOfBoardMeeting,16:00:00,0,,End time of board meeting,EndTimeOfBoardMeeting
WhetherCashFlowStatementIsApplicableOnCompany,true,0,,Whether cash flow statement is applicable on company,WhetherCashFlowStatementIsApplicableOnCompany
TypeOfCashFlowStatement,Cash Flow Indirect,0,,Type of cash flow statement,TypeOfCashFlowStatement
DeclarationOfUnmodifiedOpinionOrStatementOnImpactOfAuditQualification,Not applicable,0,,Declaration of unmodified opinion or statement on impact of audit qualification,DeclarationOfUnmodifiedOpinionOrStatementOnImpactOfAuditQualification
DateOfStartOfReportingPeriod,2024-07-01,0,,Date of start of reporting period,DateOfStartOfReportingPeriod
DateOfEndOfReportingPeriod,2024-09-30,0,,Date of end of reporting period,DateOfEndOfReportingPeriod
WhetherResultsAreAuditedOrUnaudited,Audited,0,,Whether results are audited or unaudited,WhetherResultsAreAuditedOrUnaudited
NatureOfReportStandaloneConsolidated,Consolidated,0,,Nature of report standalone consolidated,NatureOfReportStandaloneConsolidated
RevenueFromOperations,642590000000,-7,INR,Revenue from operations,RevenueFromOperations
OtherIncome,7290000000,-7,INR,Other income,OtherIncome
Income,649880000000,-7,INR,Total income,IncomeTotalIncome
CostOfMaterialsConsumed,0,-7,INR,Cost of materials consumed,CostOfMaterialsConsumed
PurchasesOfStockInTrade,0,-7,INR,Purchases of stock-in-trade,PurchasesOfStockInTrade
ChangesInInventoriesOfFinishedGoodsWorkInProgressAndStockInTrade,0,-7,INR,Changes in inventories of finished goods'| work-in-progress and stock-in-trade,ChangesInInventoriesOfFinishedGoodsWorkInProgressAndStockInTrade
EmployeeBenefitExpense,366540000000,-7,INR,Employee benefit expense,EmployeeBenefitExpense
FinanceCosts,1620000000,-7,INR,Finance costs,FinanceCosts
DepreciationDepletionAndAmortisationExpense,12660000000,-7,INR,Depreciation'| depletion and amortisation expense,DepreciationDepletionAndAmortisationExpense
OtherExpenses,108740000000,-7,INR,Other expenses Sum,OtherExpensesOtherExpensesSum
Expenses,489560000000,-7,INR,Total Expenses,ExpensesTotalExpenses
ProfitBeforeExceptionalItemsAndTax,160320000000,-7,INR,Total profit before exceptional items and tax,ProfitBeforeExceptionalItemsAndTaxTotalProfitBeforeExceptionalItemsAndTax
ExceptionalItemsBeforeTax,0,-7,INR,Exceptional items before tax,ExceptionalItemsBeforeTax
ProfitBeforeTax,160320000000,-7,INR,Total profit before tax,ProfitBeforeTaxTotalProfitBeforeTax
CurrentTax,40780000000,-7,INR,Current tax,CurrentTax
DeferredTax,-10000000,-7,INR,Deferred tax,DeferredTax
TaxExpense,40770000000,-7,INR,Total tax expense,TaxExpenseTotalTaxExpense
NetMovementInRegulatoryDeferralAccountBalancesRelatedToProfitOrLossAndTheRelatedDeferredTaxMovement,0,-7,INR,Net movement in regulatory deferral account balances related to profit or loss and the related deferred tax movement,NetMovementInRegulatoryDeferralAccountBalancesRelatedToProfitOrLossAndTheRelatedDeferredTaxMovement
ProfitLossForPeriodFromContinuingOperations,119550000000,-7,INR,Net profit (loss) for period from continuing operations,ProfitLossForPeriodFromContinuingOperationsNetProfitLossForPeriodFromContinuingOperations
ProfitLossFromDiscontinuedOperationsBeforeTax,0,-7,INR,Profit (loss) from discontinued operations before tax,ProfitLossFromDiscontinuedOperationsBeforeTax
TaxExpenseOfDiscontinuedOperations,0,-7,INR,Tax expense of discontinued operations,TaxExpenseOfDiscontinuedOperations
ProfitLossFromDiscontinuedOperationsAfterTax,0,-7,INR,Net profit (loss) from discontinued operations after tax,ProfitLossFromDiscontinuedOperationsAfterTaxNetProfitLossFromDiscontinuedOperationsAfterTax
ShareOfProfitLossOfAssociatesAndJointVenturesAccountedForUsingEquityMethod,0,-7,INR,Share of profit (loss) of associates and joint ventures accounted for using equity method,ShareOfProfitLossOfAssociatesAndJointVenturesAccountedForUsingEquityMethod
ProfitLossForPeriod,119550000000,-7,INR,Total profit (loss) for period,ProfitLossForPeriodTotalProfitLossForPeriod
OtherComprehensiveIncomeNetOfTaxes,10610000000,-7,INR,Other comprehensive income net of taxes,OtherComprehensiveIncomeNetOfTaxes
ComprehensiveIncomeForThePeriod,130160000000,-7,INR,Total comprehensive income for the period,ComprehensiveIncomeForThePeriodTotalComprehensiveIncomeForThePeriod
ProfitOrLossAttributableToOwnersOfParent,119090000000,-7,INR,Profit or loss'| attributable to owners of parent,ProfitOrLossAttributableToOwnersOfParent
ProfitOrLossAttributableToNonControllingInterests,460000000,-7,INR,Profit or loss'| attributable to non-controlling interests,ProfitOrLossAttributableToNonControllingInterests
ComprehensiveIncomeForThePeriodAttributableToOwnersOfParent,128960000000,-7,INR,Total comprehensive income for the period attributable to owners of parent,ComprehensiveIncomeForThePeriodAttributableToOwnersOfParentTotalComprehensiveIncomeForThePeriodAttributableToOwnersOfParent
ComprehensiveIncomeForThePeriodAttributableToOwnersOfParentNonControllingInterests,1200000000,-7,INR,Total comprehensive income for the period attributable to owners of parent non-controlling interests,ComprehensiveIncomeForThePeriodAttributableToOwnersOfParentNonControllingInterestsTotalComprehensiveIncomeForThePeriodAttributableToOwnersOfParentNonControllingInterests
PaidUpValueOfEquityShareCapital,3620000000,-7,INR,Paid-up equity share capital,PaidUpValueOfEquityShareCapitalPaidUpEquityShareCapital
FaceValueOfEquityShareCapital,1,0,INRPerShare,Face value of equity share capital,FaceValueOfEquityShareCapital
BasicEarningsLossPerShareFromContinuingOperations,32.92,0,INRPerShare,Basic earnings (loss) per share from continuing operations,BasicEarningsLossPerShareFromContinuingOperations
DilutedEarningsLossPerShareFromContinuingOperations,32.92,0,INRPerShare,Diluted earnings (loss) per share from continuing operations,DilutedEarningsLossPerShareFromContinuingOperations
BasicEarningsLossPerShareFromDiscontinuedOperations,0,0,INRPerShare,Basic earnings (loss) per share from discontinued operations,BasicEarningsLossPerShareFromDiscontinuedOperations
DilutedEarningsLossPerShareFromDiscontinuedOperations,0,0,INRPerShare,Diluted earnings (loss) per share from discontinued operations,DilutedEarningsLossPerShareFromDiscontinuedOperations
BasicEarningsLossPerShareFromContinuingAndDiscontinuedOperations,32.92,0,INRPerShare,Total basic earnings (loss) per share from continuing and discontinued operations,BasicEarningsLossPerShareFromContinuingAndDiscontinuedOperationsTotalBasicEarningsLossPerShareFromContinuingAndDiscontinuedOperations
DilutedEarningsLossPerShareFromContinuingAndDiscontinuedOperations,32.92,0,INRPerShare,Total diluted earnings (loss) per share from continuing and discontinued operations,DilutedEarningsLossPerShareFromContinuingAndDiscontinuedOperationsTotalDilutedEarningsLossPerShareFromContinuingAndDiscontinuedOperations
OtherExpenses,32300000000,-7,INR,Cost of equipment and software licences,OtherExpensesCostOfEquipmentAndSoftwareLicences
OtherExpenses,76440000000,-7,INR,Other expenses,OtherExpenses
SegmentRevenue,237850000000,-7,INR,Banking'| Financial Services and Insurance,SegmentRevenueBankingFinancialServicesAndInsurance
SegmentRevenue,63100000000,-7,INR,Manufacturing,SegmentRevenueManufacturing
SegmentRevenue,100250000000,-7,INR,Consumer Business,SegmentRevenueConsumerBusiness
SegmentRevenue,120880000000,-7,INR,Communication'| Media and Technology,SegmentRevenueCommunicationMediaAndTechnology
SegmentRevenue,66300000000,-7,INR,Life Sciences and Healthcare,SegmentRevenueLifeSciencesAndHealthcare
SegmentRevenue,54210000000,-7,INR,Others,SegmentRevenueOthers
SegmentRevenue,642590000000,-7,INR,Segment revenue,SegmentRevenue
SegmentRevenueFromOperations,642590000000,-7,INR,Revenue from operations,SegmentRevenueFromOperationsRevenueFromOperations
SegmentProfitLossBeforeTaxAndFinanceCosts,63450000000,-7,INR,Banking'| Financial Services and Insurance,SegmentProfitLossBeforeTaxAndFinanceCostsBankingFinancialServicesAndInsurance
SegmentProfitLossBeforeTaxAndFinanceCosts,20630000000,-7,INR,Manufacturing,SegmentProfitLossBeforeTaxAndFinanceCostsManufacturing
SegmentProfitLossBeforeTaxAndFinanceCosts,26950000000,-7,INR,Consumer Business,SegmentProfitLossBeforeTaxAndFinanceCostsConsumerBusiness
SegmentProfitLossBeforeTaxAndFinanceCosts,23570000000,-7,INR,Communication'| Media and Technology,SegmentProfitLossBeforeTaxAndFinanceCostsCommunicationMediaAndTechnology
SegmentProfitLossBeforeTaxAndFinanceCosts,18490000000,-7,INR,Life Sciences and Healthcare,SegmentProfitLossBeforeTaxAndFinanceCostsLifeSciencesAndHealthcare
SegmentProfitLossBeforeTaxAndFinanceCosts,14220000000,-7,INR,Others,SegmentProfitLossBeforeTaxAndFinanceCostsOthers
SegmentProfitLossBeforeTaxAndFinanceCosts,167310000000,-7,INR,Segment profit (loss) before tax and finance costs,SegmentProfitLossBeforeTaxAndFinanceCosts
SegmentFinanceCosts,1620000000,-7,INR,Segment finance costs,SegmentFinanceCosts
OtherUnallocableExpenditureNetOffUnAllocableIncome,5370000000,-7,INR,Other unallocable expenditure net off un-allocable income,OtherUnallocableExpenditureNetOffUnAllocableIncome
SegmentProfitBeforeTax,160320000000,-7,INR,Profit before tax,SegmentProfitBeforeTaxProfitBeforeTax
SegmentAssets,0,-7,INR,Banking'| Financial Services and Insurance,SegmentAssetsBankingFinancialServicesAndInsurance
SegmentAssets,0,-7,INR,Manufacturing,SegmentAssetsManufacturing
SegmentAssets,0,-7,INR,Consumer Business,SegmentAssetsConsumerBusiness
SegmentAssets,0,-7,INR,Communication'| Media and Technology,SegmentAssetsCommunicationMediaAndTechnology
SegmentAssets,0,-7,INR,Life Sciences and Healthcare,SegmentAssetsLifeSciencesAndHealthcare
SegmentAssets,0,-7,INR,Others,SegmentAssetsOthers
SegmentAssets,0,-7,INR,Segment assets,SegmentAssets
NetSegmentAssets,0,-7,INR,Net segment assets,NetSegmentAssets
SegmentLiabilities,0,-7,INR,Banking'| Financial Services and Insurance,SegmentLiabilitiesBankingFinancialServicesAndInsurance
SegmentLiabilities,0,-7,INR,Manufacturing,SegmentLiabilitiesManufacturing
SegmentLiabilities,0,-7,INR,Consumer Business,SegmentLiabilitiesConsumerBusiness
SegmentLiabilities,0,-7,INR,Communication'| Media and Technology,SegmentLiabilitiesCommunicationMediaAndTechnology
SegmentLiabilities,0,-7,INR,Life Sciences and Healthcare,SegmentLiabilitiesLifeSciencesAndHealthcare
SegmentLiabilities,0,-7,INR,Others,SegmentLiabilitiesOthers
SegmentLiabilities,0,-7,INR,Segment liabilities,SegmentLiabilities
NetSegmentLiabilities,0,-7,INR,Net segment liabilities,NetSegmentLiabilities
AmountOfItemThatWillNotBeReclassifiedToProfitAndLoss,-380000000,-7,INR,Remeasurement of defined employee benefit plans,AmountOfItemThatWillNotBeReclassifiedToProfitAndLossRemeasurementOfDefinedEmployeeBenefitPlans
AmountOfItemThatWillNotBeReclassifiedToProfitAndLoss,-120000000,-7,INR,Net change in fair values of investments in equity shares carried at fair value through OCI,AmountOfItemThatWillNotBeReclassifiedToProfitAndLossNetChangeInFairValuesOfInvestmentsInEquitySharesCarriedAtFairValueThroughOci
AmountOfItemThatWillNotBeReclassifiedToProfitAndLoss,-500000000,-7,INR,Amount of item that will not be reclassified to profit and loss,AmountOfItemThatWillNotBeReclassifiedToProfitAndLoss
IncomeTaxRelatingToItmesThatWillNotBeReclassifiedToProfitOrLoss,-100000000,-7,INR,Income tax relating to items that will not be reclassified to profit or loss,IncomeTaxRelatingToItmesThatWillNotBeReclassifiedToProfitOrLossIncomeTaxRelatingToItemsThatWillNotBeReclassifiedToProfitOrLoss
AmountOfItemThatWillBeReclassifiedToProfitAndLoss,3920000000,-7,INR,Net change in fair values of investments other than equity shares carried at fair value through OCI,AmountOfItemThatWillBeReclassifiedToProfitAndLossNetChangeInFairValuesOfInvestmentsOtherThanEquitySharesCarriedAtFairValueThroughOci
AmountOfItemThatWillBeReclassifiedToProfitAndLoss,-140000000,-7,INR,Net change in intrinsic value of derivatives designated as cash flow hedges,AmountOfItemThatWillBeReclassifiedToProfitAndLossNetChangeInIntrinsicValueOfDerivativesDesignatedAsCashFlowHedges
AmountOfItemThatWillBeReclassifiedToProfitAndLoss,-230000000,-7,INR,Net change in time value of derivatives designated as cash flow hedges,AmountOfItemThatWillBeReclassifiedToProfitAndLossNetChangeInTimeValueOfDerivativesDesignatedAsCashFlowHedges
AmountOfItemThatWillBeReclassifiedToProfitAndLoss,8350000000,-7,INR,Exchange differences on translation of financial statements of foreign operations,AmountOfItemThatWillBeReclassifiedToProfitAndLossExchangeDifferencesOnTranslationOfFinancialStatementsOfForeignOperations
AmountOfItemThatWillBeReclassifiedToProfitAndLoss,11900000000,-7,INR,Amount of item that will be reclassified to profit and loss,AmountOfItemThatWillBeReclassifiedToProfitAndLoss
IncomeTaxRelatingToItmesThatWillBeReclassifiedToProfitOrLoss,890000000,-7,INR,Income tax relating to items that will be reclassified to profit or loss,IncomeTaxRelatingToItmesThatWillBeReclassifiedToProfitOrLossIncomeTaxRelatingToItemsThatWillBeReclassifiedToProfitOrLoss
XbrlUrl,https://www.bseindia.com/XBRLFILES/FourOneUploadDocument/Main_Ind_As_532540_1010202418510.xml,0,,XbrlUrl,
